Identificador,nombre
http://www.group10.org/pl/resource/Street/S749,CALLE DE JOSE CELESTINO MUTIS
http://www.group10.org/pl/resource/Street/S750,PASAJE DE LA BISBAL
http://www.group10.org/pl/resource/Street/S751,CALLE DE LANUZA
http://www.group10.org/pl/resource/Street/S752,CALLE DE LEON BONNAT
http://www.group10.org/pl/resource/Street/S753,CALLE DE LOS PEÑASCALES
http://www.group10.org/pl/resource/Street/S754,CALLE DEL MAESTRO ALONSO
http://www.group10.org/pl/resource/Street/S755,CALLE DEL MARQUES DE LA HERMIDA
http://www.group10.org/pl/resource/Street/S756,CALLE DEL MARQUES DE MONDEJAR
http://www.group10.org/pl/resource/Street/S757,CALLE DEL MARQUES DE VALLEJO
http://www.group10.org/pl/resource/Street/S758,CALLE DEL MARQUES DE ZAFRA
http://www.group10.org/pl/resource/Street/S759,GLORIETA DEL MARQUES DE ZAFRA
http://www.group10.org/pl/resource/Street/S760,PASEO DEL MARQUES DE ZAFRA
http://www.group10.org/pl/resource/Street/S761,CALLE DE MERCEDES FORMICA
http://www.group10.org/pl/resource/Street/S762,CALLE DE PEDRO HEREDIA
http://www.group10.org/pl/resource/Street/S763,CALLE DE PEYRE
http://www.group10.org/pl/resource/Street/S764,CALLE DEL PINTOR DOMINGUEZ
http://www.group10.org/pl/resource/Street/S765,CALLE DEL PORVENIR
http://www.group10.org/pl/resource/Street/S766,CALLE DE RAFAEL JUAN Y SEVA
http://www.group10.org/pl/resource/Street/S767,CALLE DE RAMON DE AGUINAGA
http://www.group10.org/pl/resource/Street/S768,CALLE DE RUFINO BLANCO
http://www.group10.org/pl/resource/Street/S769,CALLE DE SANCHO DAVILA
http://www.group10.org/pl/resource/Street/S770,CALLE DE VICALVARO
http://www.group10.org/pl/resource/Street/S771,CALLE DEL VIZCONDE DE MATAMALA
http://www.group10.org/pl/resource/Street/S772,AUTOVIA A-2
http://www.group10.org/pl/resource/Street/S773,CALLE DE AGUSTIN DURAN
http://www.group10.org/pl/resource/Street/S774,CALLE DE ALONSO HEREDIA
http://www.group10.org/pl/resource/Street/S775,AVENIDA DE AMERICA
http://www.group10.org/pl/resource/Street/S776,CALLE DE AMOROS
http://www.group10.org/pl/resource/Street/S777,CALLE DE ANDRES TAMAYO
http://www.group10.org/pl/resource/Street/S778,CALLE DE ANTONIA RUIZ SORO
http://www.group10.org/pl/resource/Street/S779,CALLE DE ARDEMANS
http://www.group10.org/pl/resource/Street/S780,CALLE DE AZCONA
http://www.group10.org/pl/resource/Street/S781,PLAZA DE BASILEA
http://www.group10.org/pl/resource/Street/S782,AVENIDA DE BAVIERA
http://www.group10.org/pl/resource/Street/S783,CALLE DE BAYONA
http://www.group10.org/pl/resource/Street/S784,CALLE DE BERLIN
http://www.group10.org/pl/resource/Street/S785,CALLE DE BERNA
http://www.group10.org/pl/resource/Street/S786,CALLE DE BIARRITZ
http://www.group10.org/pl/resource/Street/S787,CALLE DE BOLONIA
http://www.group10.org/pl/resource/Street/S788,AVENIDA DE BONN
http://www.group10.org/pl/resource/Street/S789,CALLE DE BOSTON
http://www.group10.org/pl/resource/Street/S790,PLAZA DE BOSTON
http://www.group10.org/pl/resource/Street/S791,AVENIDA DE BRASILIA
http://www.group10.org/pl/resource/Street/S792,CALLE DE BREMEN
http://www.group10.org/pl/resource/Street/S793,CALLE DE BRESCIA
http://www.group10.org/pl/resource/Street/S794,CALLE DE BRISTOL
http://www.group10.org/pl/resource/Street/S795,AVENIDA DE BRUSELAS
http://www.group10.org/pl/resource/Street/S796,PLAZA DE BURDEOS
http://www.group10.org/pl/resource/Street/S797,AVENIDA DE CAMILO JOSE CELA
http://www.group10.org/pl/resource/Street/S798,CALLE DEL CAMPANAR
http://www.group10.org/pl/resource/Street/S799,ARROYO DEL CANALILLO
http://www.group10.org/pl/resource/Street/S800,CALLE DEL CANALILLO
http://www.group10.org/pl/resource/Street/S801,CAMINO DE CANILLAS
http://www.group10.org/pl/resource/Street/S802,CALLE DEL CARDENAL BELLUGA
http://www.group10.org/pl/resource/Street/S803,CALLE DE CARTAGENA
http://www.group10.org/pl/resource/Street/S804,CALLE DE CASTELAR
http://www.group10.org/pl/resource/Street/S805,CALLE DE COLOMER
http://www.group10.org/pl/resource/Street/S806,CALLE DEL CONDE DE VILCHES
http://www.group10.org/pl/resource/Street/S807,CALLE DE COSLADA
http://www.group10.org/pl/resource/Street/S808,CALLE DEL DOCTOR GOMEZ ULLA
http://www.group10.org/pl/resource/Street/S809,CALLE DE EDUARDO VICENTE
http://www.group10.org/pl/resource/Street/S810,CALLE DE ERASO
http://www.group10.org/pl/resource/Street/S811,CALLE DE FERRER DEL RIO
http://www.group10.org/pl/resource/Street/S812,CALLE DE FLORESTAN AGUILAR
http://www.group10.org/pl/resource/Street/S813,CALLE DE FRANCISCO ALTIMIRAS
http://www.group10.org/pl/resource/Street/S814,CALLE DE FRANCISCO NAVACERRADA
http://www.group10.org/pl/resource/Street/S815,CALLE DE FRANCISCO REMIRO
http://www.group10.org/pl/resource/Street/S816,CALLE DE FRANCISCO SANTOS
http://www.group10.org/pl/resource/Street/S817,CALLE DE FRANCISCO SILVELA
http://www.group10.org/pl/resource/Street/S818,CALLE DE FRANCISCO ZEA
http://www.group10.org/pl/resource/Street/S819,PASAJE DE LA FUNDACION
http://www.group10.org/pl/resource/Street/S820,CALLE DE LA GRANJILLA
http://www.group10.org/pl/resource/Street/S821,AVENIDA DE LA GUINDALERA
http://www.group10.org/pl/resource/Street/S822,CALLE DE IRIARTE
http://www.group10.org/pl/resource/Street/S823,CALLE DE JESUS MENDEZ
http://www.group10.org/pl/resource/Street/S824,CALLE DE JOSE MARIA SANCHEZ SILVA
http://www.group10.org/pl/resource/Street/S825,CALLE DE JOSE PICON
http://www.group10.org/pl/resource/Street/S826,CALLE DE JUAN DE LA HOZ
http://www.group10.org/pl/resource/Street/S827,CALLE DE JULIO CAMBA
http://www.group10.org/pl/resource/Street/S828,CALLE DE LA POVEDA
http://www.group10.org/pl/resource/Street/S829,CALLE DE LONDRES
http://www.group10.org/pl/resource/Street/S830,CALLE DE LUIS ADARO
http://www.group10.org/pl/resource/Street/S831,CALLE DE LUIS CALVO
http://www.group10.org/pl/resource/Street/S832,CALLE DE LUIS DIAZ COBEÑA
http://www.group10.org/pl/resource/Street/S833,CALLE DE MARIA TERESA
http://www.group10.org/pl/resource/Street/S834,CALLE DEL MARQUES DE AHUMADA
http://www.group10.org/pl/resource/Street/S835,CALLE DEL MARQUES DE MONTEAGUDO
http://www.group10.org/pl/resource/Street/S836,CALLE DE MARTINEZ IZQUIERDO
http://www.group10.org/pl/resource/Street/S837,CALLE DE MEJICO
http://www.group10.org/pl/resource/Street/S838,CALLE DE NUESTRA SEÑORA DE GUADALUPE
http://www.group10.org/pl/resource/Street/S839,CALLE DE OLTRA
http://www.group10.org/pl/resource/Street/S840,CALLE DE ORCASITAS
http://www.group10.org/pl/resource/Street/S841,CALLE DE OTERO
http://www.group10.org/pl/resource/Street/S842,CALLE DEL PARRAL
http://www.group10.org/pl/resource/Street/S843,AVENIDA DE LA PAZ
http://www.group10.org/pl/resource/Street/S844,CALLE DE PILAR DE ZARAGOZA
http://www.group10.org/pl/resource/Street/S845,CALLE DEL PINTOR MORENO CARBONERO
http://www.group10.org/pl/resource/Street/S846,CALLE DE RAFAELA BONILLA
http://www.group10.org/pl/resource/Street/S847,CALLE DE ROBERTO DOMINGO
http://www.group10.org/pl/resource/Street/S848,CALLE DE ROMA
http://www.group10.org/pl/resource/Street/S849,CALLE DE RUIZ OCAÑA
http://www.group10.org/pl/resource/Street/S850,CALLE DE RUIZ PERELLO
http://www.group10.org/pl/resource/Street/S851,CALLE DE SALVADOR GRANES
http://www.group10.org/pl/resource/Street/S852,AVENIDA DE LOS TOREROS
http://www.group10.org/pl/resource/Street/S853,PLAZA DE VENECIA
http://www.group10.org/pl/resource/Street/S854,CALLE DE VILLAFRANCA
http://www.group10.org/pl/resource/Street/S855,CALLE DE DIEGO DE LEON
http://www.group10.org/pl/resource/Street/S856,CALLE DEL GENERAL ORAA
http://www.group10.org/pl/resource/Street/S857,CALLE DE JOSE ORTEGA Y GASSET
http://www.group10.org/pl/resource/Street/S858,CALLE DE JUAN BRAVO
http://www.group10.org/pl/resource/Street/S859,CALLE DE MALDONADO
http://www.group10.org/pl/resource/Street/S860,PLAZA DEL MARQUES DE SALAMANCA
http://www.group10.org/pl/resource/Street/S861,PASAJE DE MONTESA
http://www.group10.org/pl/resource/Street/S862,CALLE DE PADILLA
http://www.group10.org/pl/resource/Street/S863,CALLE DE LOS HERMANOS BECQUER
http://www.group10.org/pl/resource/Street/S864,CALLE DE LOPEZ DE HOYOS
http://www.group10.org/pl/resource/Street/S865,CALLE DEL MARQUES DE VILLAMAGNA
http://www.group10.org/pl/resource/Street/S866,CALLE DEL MARQUES DE VILLAMEJOR
http://www.group10.org/pl/resource/Street/S867,CALLE DEL PINAR
http://www.group10.org/pl/resource/Street/S868,CALLE DE SALAS
http://www.group10.org/pl/resource/Street/S869,CALLE DE ALFONSO RODRIGUEZ SANTAMARIA
http://www.group10.org/pl/resource/Street/S870,CALLE DE ALVAREZ DE BAENA
http://www.group10.org/pl/resource/Street/S871,CALLE DE ANTONIO PEREZ
http://www.group10.org/pl/resource/Street/S872,CALLE DE ANTONIO RODRIGUEZ VILLA
http://www.group10.org/pl/resource/Street/S873,CALLE DEL ARGA
http://www.group10.org/pl/resource/Street/S874,CALLE DE ARMANDO PALACIO VALDES
http://www.group10.org/pl/resource/Street/S875,CALLE DEL AVIADOR LINDBERGH
http://www.group10.org/pl/resource/Street/S876,CALLE DE BALBINA VALVERDE
http://www.group10.org/pl/resource/Street/S877,CALLE DE BELALCAZAR
http://www.group10.org/pl/resource/Street/S878,PASAJE DE BELALCAZAR
http://www.group10.org/pl/resource/Street/S879,CALLE DEL BIDASOA
http://www.group10.org/pl/resource/Street/S880,CALLE DE LAS CALERAS
http://www.group10.org/pl/resource/Street/S881,CALLE DE CARBONERO Y SOL
http://www.group10.org/pl/resource/Street/S882,PLAZA DE CARLOS MARIA DE CASTRO
http://www.group10.org/pl/resource/Street/S883,CALLE DE CASTELLON DE LA PLANA
http://www.group10.org/pl/resource/Street/S884,CALLE DEL CIDACOS
http://www.group10.org/pl/resource/Street/S885,CALLE DEL CINCA
http://www.group10.org/pl/resource/Street/S886,AVENIDA DE CONCHA ESPINA
http://www.group10.org/pl/resource/Street/S887,CALLE DE DANIEL URRABIETA
http://www.group10.org/pl/resource/Street/S888,CALLE DE DARRO
http://www.group10.org/pl/resource/Street/S889,AVENIDA DEL DOCTOR ARCE
http://www.group10.org/pl/resource/Street/S890,CALLE DEL DUQUE DE SEVILLA
http://www.group10.org/pl/resource/Street/S891,CALLE DE DURAN
http://www.group10.org/pl/resource/Street/S892,CALLE DEL EBRO
http://www.group10.org/pl/resource/Street/S893,CALLE DE EDISON
http://www.group10.org/pl/resource/Street/S894,CALLE DEL EGA
http://www.group10.org/pl/resource/Street/S895,CALLE DE EMILIO CAMPION
http://www.group10.org/pl/resource/Street/S896,CALLE DEL ERESMA
http://www.group10.org/pl/resource/Street/S897,CALLE DE ESTEVEZ
http://www.group10.org/pl/resource/Street/S898,CALLE DE FELIPE CAMPOS
http://www.group10.org/pl/resource/Street/S899,CALLE DE FELIPE PEREZ Y GONZALEZ
http://www.group10.org/pl/resource/Street/S900,CALLE DE FRANCISCO ALCANTARA
http://www.group10.org/pl/resource/Street/S901,CALLE DE FRANCISCO CAMPOS
http://www.group10.org/pl/resource/Street/S902,CALLE DE FRANCISCO DE ASIS MENDEZ CASARIEGO
http://www.group10.org/pl/resource/Street/S903,CALLE DE FRANCO
http://www.group10.org/pl/resource/Street/S904,CALLE DE FRAY JUAN GIL
http://www.group10.org/pl/resource/Street/S905,CALLE DE GABRIEL LOBO
http://www.group10.org/pl/resource/Street/S906,CALLE DE GALLARZA
http://www.group10.org/pl/resource/Street/S907,CALLE DEL GENIL
http://www.group10.org/pl/resource/Street/S908,CALLE DE GOMEZ CANO
http://www.group10.org/pl/resource/Street/S909,CALLE DE GOMEZ ORTEGA
http://www.group10.org/pl/resource/Street/S910,CALLE DE GRIJALBA
http://www.group10.org/pl/resource/Street/S911,CALLE DEL GUADALQUIVIR
http://www.group10.org/pl/resource/Street/S912,CALLE DEL GUADIANA
http://www.group10.org/pl/resource/Street/S913,CALLE DE GUTIERREZ SOLANA
http://www.group10.org/pl/resource/Street/S914,CALLE DEL HELECHO
http://www.group10.org/pl/resource/Street/S915,CALLE DE LOS HERMANOS PINZON
http://www.group10.org/pl/resource/Street/S916,CALLE DE HERMENEGILDA MARTINEZ
http://www.group10.org/pl/resource/Street/S917,CALLE DEL IRATI
http://www.group10.org/pl/resource/Street/S918,CALLE DEL JARAMA
http://www.group10.org/pl/resource/Street/S919,CALLE DE JOAQUIN COSTA
http://www.group10.org/pl/resource/Street/S920,CALLE DE JOAQUIN MONTES JOVELLAR
http://www.group10.org/pl/resource/Street/S921,CALLE DE JORGE MANRIQUE
http://www.group10.org/pl/resource/Street/S922,PLAZA DE JOSÉ CASTILLEJO
http://www.group10.org/pl/resource/Street/S923,CALLE DE JOSE GUTIERREZ ABASCAL
http://www.group10.org/pl/resource/Street/S924,CALLE DE JUAN DE LA CIERVA
http://www.group10.org/pl/resource/Street/S925,PASEO DE LA HABANA
http://www.group10.org/pl/resource/Street/S926,CALLE DEL LEIZARAN
http://www.group10.org/pl/resource/Street/S927,CALLE DEL LEREZ
http://www.group10.org/pl/resource/Street/S928,CALLE DE LORIGA
http://www.group10.org/pl/resource/Street/S929,CALLE DE LUIS MURIEL
http://www.group10.org/pl/resource/Street/S930,CALLE DE LA MADRE CARMEN DEL NIÑO JESUS
http://www.group10.org/pl/resource/Street/S931,CALLE DEL MAESTRO RIPOLL
http://www.group10.org/pl/resource/Street/S932,CALLE DE MARCELIANO SANTA MARIA
http://www.group10.org/pl/resource/Street/S933,CALLE DE MARIA FRANCISCA
http://www.group10.org/pl/resource/Street/S934,PLAZA DE MARIA GUERRERO
http://www.group10.org/pl/resource/Street/S935,CALLE DEL MARQUES DE VALDECILLA
http://www.group10.org/pl/resource/Street/S936,CALLE DEL MIÑO
http://www.group10.org/pl/resource/Street/S937,CALLE DEL NERVION
http://www.group10.org/pl/resource/Street/S938,CALLE DE NIELFA
http://www.group10.org/pl/resource/Street/S939,CALLE DE OQUENDO
http://www.group10.org/pl/resource/Street/S940,CALLE DEL ORIA
http://www.group10.org/pl/resource/Street/S941,CALLE DE PABLO ARANDA
http://www.group10.org/pl/resource/Street/S942,CALLE DE PEDRO DE VALDIVIA
http://www.group10.org/pl/resource/Street/S943,CALLE DEL PISUERGA
http://www.group10.org/pl/resource/Street/S944,PLAZA DEL POETA MANUEL DEL PALACIO
http://www.group10.org/pl/resource/Street/S945,CALLE DEL PRINCIPE DE VERGARA
http://www.group10.org/pl/resource/Street/S946,CALLE DEL PUENTE DEL DUERO
http://www.group10.org/pl/resource/Street/S947,PLAZA DE QUITO
http://www.group10.org/pl/resource/Street/S948,CALLE DE RECAREDO
http://www.group10.org/pl/resource/Street/S949,PLAZA DE LA REPUBLICA ARGENTINA
http://www.group10.org/pl/resource/Street/S950,PLAZA DE RODRIGO URIA
http://www.group10.org/pl/resource/Street/S951,CALLE DE RODRIGUEZ MARIN
http://www.group10.org/pl/resource/Street/S952,CALLE DE RONCAL
http://www.group10.org/pl/resource/Street/S953,CALLE DE SAN JUAN DE LA SALLE
http://www.group10.org/pl/resource/Street/S954,CALLE DE SAN JULIO
http://www.group10.org/pl/resource/Street/S955,CALLE DE SANTIAGO ARTIGAS
http://www.group10.org/pl/resource/Street/S956,CALLE DE SANTIAGO BERNABEU
http://www.group10.org/pl/resource/Street/S957,CALLE DE SANTO DOMINGO DE SILOS
http://www.group10.org/pl/resource/Street/S958,CALLE DE SANTORCAZ
http://www.group10.org/pl/resource/Street/S959,CALLE DEL SEGRE
http://www.group10.org/pl/resource/Street/S960,CALLE DE SERRANO
http://www.group10.org/pl/resource/Street/S961,CALLE DEL SIL
http://www.group10.org/pl/resource/Street/S962,CALLE DEL TAJO
http://www.group10.org/pl/resource/Street/S963,CALLE DEL TAMBRE
http://www.group10.org/pl/resource/Street/S964,CALLE DEL TORMES
http://www.group10.org/pl/resource/Street/S965,CALLE DEL TURIA
http://www.group10.org/pl/resource/Street/S966,CALLE DEL UROLA
http://www.group10.org/pl/resource/Street/S967,CALLE DEL URUMEA
http://www.group10.org/pl/resource/Street/S968,CALLE DE VITRUVIO
http://www.group10.org/pl/resource/Street/S969,CALLE DE ALUSTANTE
http://www.group10.org/pl/resource/Street/S970,CALLE DE ANASTASIO AROCA
http://www.group10.org/pl/resource/Street/S971,CALLE DE ANGEL HERNANDEZ
http://www.group10.org/pl/resource/Street/S972,CALLE DE ANTONIO GUZMAN
http://www.group10.org/pl/resource/Street/S973,CALLE DE ANTONIO SALCES
http://www.group10.org/pl/resource/Street/S974,CALLE DE ANTONIO ZAPATA
http://www.group10.org/pl/resource/Street/S975,CALLE DE ANZUOLA
http://www.group10.org/pl/resource/Street/S976,CALLE DE BAEZA
http://www.group10.org/pl/resource/Street/S977,CALLE DE CANILLAS
http://www.group10.org/pl/resource/Street/S978,CALLE DEL CARDENAL SILICEO
http://www.group10.org/pl/resource/Street/S979,CALLE DE CARLOS BALENCHANA
http://www.group10.org/pl/resource/Street/S980,CALLE DE CLARA DEL REY
http://www.group10.org/pl/resource/Street/S981,CALLE DE LA CONSTANCIA
http://www.group10.org/pl/resource/Street/S982,CALLE DEL CORAZON DE MARIA
http://www.group10.org/pl/resource/Street/S983,CALLE DE DAGANZO
http://www.group10.org/pl/resource/Street/S984,CALLE DE DIAZ ZORITA
http://www.group10.org/pl/resource/Street/S985,PASAJE DE DOLORES
http://www.group10.org/pl/resource/Street/S986,PASAJE DE DOÑA CARLOTA
http://www.group10.org/pl/resource/Street/S987,CALLE DE EUGENIO SALAZAR
http://www.group10.org/pl/resource/Street/S988,CALLE DE FRANCISCO GIRALTE
http://www.group10.org/pl/resource/Street/S989,CALLE DE FRANCISCO VIVANCOS
http://www.group10.org/pl/resource/Street/S990,CALLE DEL GENERAL ZABALA
http://www.group10.org/pl/resource/Street/S991,CALLE DE GUSTAVO FERNANDEZ BALBUENA
http://www.group10.org/pl/resource/Street/S992,CALLE DE HORCAJUELO
http://www.group10.org/pl/resource/Street/S993,CALLE DE HUELVA
http://www.group10.org/pl/resource/Street/S994,CALLE DE JUAN BAUTISTA DE TOLEDO
http://www.group10.org/pl/resource/Street/S995,CALLE DE JULIO LOPEZ
http://www.group10.org/pl/resource/Street/S996,CALLE DE LUIS CABRERA
http://www.group10.org/pl/resource/Street/S997,CALLE DE LUIS DE SALAZAR
http://www.group10.org/pl/resource/Street/S998,PASAJE DE MANGIRON
http://www.group10.org/pl/resource/Street/S999,CALLE DE MARTIN MACHIO
http://www.group10.org/pl/resource/Street/S1000,CALLE DE MATAELPINO
http://www.group10.org/pl/resource/Street/S1001,CALLE DE MAURO
http://www.group10.org/pl/resource/Street/S1002,CALLE DEL PADRE CLARET
http://www.group10.org/pl/resource/Street/S1003,CALLE DEL PADRE INDALECIO HERNANDEZ
http://www.group10.org/pl/resource/Street/S1004,CALLE DEL PADRE JESUS ORDOÑEZ
http://www.group10.org/pl/resource/Street/S1005,CALLE DEL PADRE XIFRE
http://www.group10.org/pl/resource/Street/S1006,CALLE DE PINILLA DEL VALLE
http://www.group10.org/pl/resource/Street/S1007,CALLE DEL POETA CLAUDIO RODRIGUEZ
http://www.group10.org/pl/resource/Street/S1008,CALLE DE PRADENA DEL RINCON
http://www.group10.org/pl/resource/Street/S1009,PASAJE DE PRADILLO
http://www.group10.org/pl/resource/Street/S1010,CALLE DE PUENTEAREAS
http://www.group10.org/pl/resource/Street/S1011,CALLE DE QUINTILIANO
http://www.group10.org/pl/resource/Street/S1012,CALLE DE RAMOS CARRION
http://www.group10.org/pl/resource/Street/S1013,CALLE DE ROBREGORDO
http://www.group10.org/pl/resource/Street/S1014,CALLE DE ROS DE OLANO
http://www.group10.org/pl/resource/Street/S1015,CALLE DE SAN FERNANDO DEL JARAMA
http://www.group10.org/pl/resource/Street/S1016,CALLE DE SAN NAZARIO
http://www.group10.org/pl/resource/Street/S1017,PASAJE DE SAN PEDRO
http://www.group10.org/pl/resource/Street/S1018,CALLE DE SANCHEZ BALDERAS
http://www.group10.org/pl/resource/Street/S1019,CALLE DE SANTA HORTENSIA
http://www.group10.org/pl/resource/Street/S1020,CALLE DE SANTA MARIA DE LA ALAMEDA
http://www.group10.org/pl/resource/Street/S1021,CALLE DE SANTA RITA
http://www.group10.org/pl/resource/Street/S1022,PASAJE DE VALVERDE DE ALCALA
http://www.group10.org/pl/resource/Street/S1023,CALLE DE ZABALETA
http://www.group10.org/pl/resource/Street/S1024,CALLE DE ABANTOS
http://www.group10.org/pl/resource/Street/S1025,CALLE DE AGUSTIN DE ROJAS
http://www.group10.org/pl/resource/Street/S1026,AVENIDA DE ALFONSO XIII
http://www.group10.org/pl/resource/Street/S1027,PLAZA DE ANDRES SEGOVIA
http://www.group10.org/pl/resource/Street/S1028,CALLE DE ARAGON
http://www.group10.org/pl/resource/Street/S1029,CALLE DE LA ATALAYA
http://www.group10.org/pl/resource/Street/S1030,CALLE DE BENIGNO SOTO
http://www.group10.org/pl/resource/Street/S1031,CALLE DE LAS CAMPANILLAS
http://www.group10.org/pl/resource/Street/S1032,CALLE DE CARLOS PEREYRA
http://www.group10.org/pl/resource/Street/S1033,CALLE DE CASTREJON
http://www.group10.org/pl/resource/Street/S1034,CALLE DE LA CHARCA VERDE
http://www.group10.org/pl/resource/Street/S1035,PLAZA DE LA CHARCA VERDE
http://www.group10.org/pl/resource/Street/S1036,CALLE DE CLAVILEÑO
http://www.group10.org/pl/resource/Street/S1037,PASAJE DE CLAVILEÑO
http://www.group10.org/pl/resource/Street/S1038,CALLE DE LA CONDESA DE SANTAMARCA
http://www.group10.org/pl/resource/Street/S1039,CALLE DE COTOS
http://www.group10.org/pl/resource/Street/S1040,CALLE DEL DOCTOR MARCO CORERA
http://www.group10.org/pl/resource/Street/S1041,CALLE DE EMILIO MARIO
http://www.group10.org/pl/resource/Street/S1042,CALLE DE FERNANDEZ DE OVIEDO
http://www.group10.org/pl/resource/Street/S1043,CALLE DE GABRIEL Y GALAN
http://www.group10.org/pl/resource/Street/S1044,CALLE DE GARCIA LUNA
http://www.group10.org/pl/resource/Street/S1045,CALLE DE GUERRERO Y MENDOZA
http://www.group10.org/pl/resource/Street/S1046,CALLE DE JAVIER FERRERO
http://www.group10.org/pl/resource/Street/S1047,PLAZA DE JOAQUIN RODRIGO
http://www.group10.org/pl/resource/Street/S1048,CALLE DE JOSEP PLA
http://www.group10.org/pl/resource/Street/S1049,PLAZA DE LA JUSTICIA
http://www.group10.org/pl/resource/Street/S1050,CALLE DE LA PEDRIZA
http://www.group10.org/pl/resource/Street/S1051,CALLE DE LUIS LARRAINZA
http://www.group10.org/pl/resource/Street/S1052,CALLE DE LUIS VIVES
http://www.group10.org/pl/resource/Street/S1053,CALLE DE MALCAMPO
http://www.group10.org/pl/resource/Street/S1054,CALLE DE MANTUANO
http://www.group10.org/pl/resource/Street/S1055,CALLE DE MARCENADO
http://www.group10.org/pl/resource/Street/S1056,CALLE DEL MARQUES DE SANTILLANA
http://www.group10.org/pl/resource/Street/S1057,CALLE DE MARTIN MARTINEZ
http://www.group10.org/pl/resource/Street/S1058,CALLE DE MATILDE DIEZ
http://www.group10.org/pl/resource/Street/S1059,CALLE DE MOSTOLES
http://www.group10.org/pl/resource/Street/S1060,CALLE DE NAVALAFUENTE
http://www.group10.org/pl/resource/Street/S1061,CALLE DE NIEREMBERG
http://www.group10.org/pl/resource/Street/S1062,CALLE DE PANTOJA
http://www.group10.org/pl/resource/Street/S1063,CALLE DE PECHUAN
http://www.group10.org/pl/resource/Street/S1064,CALLE DE LA PEÑOTA
http://www.group10.org/pl/resource/Street/S1065,CALLE DE PEREZ AYUSO
http://www.group10.org/pl/resource/Street/S1066,CALLE DE PEREZ HERRERA
http://www.group10.org/pl/resource/Street/S1067,CALLE DE PRADILLO
http://www.group10.org/pl/resource/Street/S1068,AVENIDA DE RAMON Y CAJAL
http://www.group10.org/pl/resource/Street/S1069,CALLE DEL REFUGIO
http://www.group10.org/pl/resource/Street/S1070,CALLE DEL RISCO DEL PAJARO
http://www.group10.org/pl/resource/Street/S1071,CALLE DE SAN ERNESTO
http://www.group10.org/pl/resource/Street/S1072,CALLE DE SANCHEZ PACHECO
http://www.group10.org/pl/resource/Street/S1073,CALLE DE SATURNINO CALLEJA
http://www.group10.org/pl/resource/Street/S1074,PLAZA DEL SOMORROSTRO
http://www.group10.org/pl/resource/Street/S1075,CALLE DE SUERO DE QUIÑONES
http://www.group10.org/pl/resource/Street/S1076,CALLE DE VINAROZ
http://www.group10.org/pl/resource/Street/S1077,CALLE DEL ACEBO
http://www.group10.org/pl/resource/Street/S1078,AVENIDA DE ALBERTO ALCOCER
http://www.group10.org/pl/resource/Street/S1079,AVENIDA DE LOS ALHELIES
http://www.group10.org/pl/resource/Street/S1080,CALLE DE ANGEL DE DIEGO ROLDAN
http://www.group10.org/pl/resource/Street/S1081,CALLE DEL ARALIA
http://www.group10.org/pl/resource/Street/S1082,AVENIDA DEL ASTER
http://www.group10.org/pl/resource/Street/S1083,CALLE DEL BELEÑO
http://www.group10.org/pl/resource/Street/S1084,CALLE DE BOLIVIA
http://www.group10.org/pl/resource/Street/S1085,CALLE DE LAS CALAS
http://www.group10.org/pl/resource/Street/S1086,CALLE DE LAS CELINDAS
http://www.group10.org/pl/resource/Street/S1087,CALLE DE CEREDA
http://www.group10.org/pl/resource/Street/S1088,PASEO DE LOS CEREZOS
http://www.group10.org/pl/resource/Street/S1089,CALLE DE CHILE
http://www.group10.org/pl/resource/Street/S1090,CALLE DE COCHABAMBA
http://www.group10.org/pl/resource/Street/S1091,CALLE DE COLOMBIA
http://www.group10.org/pl/resource/Street/S1092,CALLE DE LOS CONDES DEL VAL
http://www.group10.org/pl/resource/Street/S1093,CALLE DE COSTA RICA
http://www.group10.org/pl/resource/Street/S1094,CALLE CUARTA
http://www.group10.org/pl/resource/Street/S1095,CALLE DECIMA
http://www.group10.org/pl/resource/Street/S1096,CALLE DEL DOCTOR FLEMING
http://www.group10.org/pl/resource/Street/S1097,TRAVESIA DEL DOCTOR FLEMING
http://www.group10.org/pl/resource/Street/S1098,CALLE DE LAS ENDRINAS
http://www.group10.org/pl/resource/Street/S1099,CALLE DEL EUCALIPTO
http://www.group10.org/pl/resource/Street/S1100,CALLE DE FEDERICO GARCIA SANCHIZ
http://www.group10.org/pl/resource/Street/S1101,CALLE DE FERNAN NUÑEZ
http://www.group10.org/pl/resource/Street/S1102,CALLE DE FUENTE DEL SAZ
http://www.group10.org/pl/resource/Street/S1103,CALLE DE HERREROS DE TEJADA
http://www.group10.org/pl/resource/Street/S1104,CALLE DE LA INFANTA MARIA TERESA
http://www.group10.org/pl/resource/Street/S1105,PASEO DE LOS JACINTOS
http://www.group10.org/pl/resource/Street/S1106,CALLE DEL JILOCA
http://www.group10.org/pl/resource/Street/S1107,CALLE DE JOSE LAZARO GALDIANO
http://www.group10.org/pl/resource/Street/S1108,PLAZA DE JOSE MARIA SOLER
http://www.group10.org/pl/resource/Street/S1109,CALLE DE JUAN RAMON JIMENEZ
http://www.group10.org/pl/resource/Street/S1110,AVENIDA DEL LEVANTE
http://www.group10.org/pl/resource/Street/S1111,CALLE DE LA LIGULA
http://www.group10.org/pl/resource/Street/S1112,CALLE DE LOS LIRIOS
http://www.group10.org/pl/resource/Street/S1113,CALLE DE MANUEL DE FALLA
http://www.group10.org/pl/resource/Street/S1114,CALLE DE LOS NARCISOS
http://www.group10.org/pl/resource/Street/S1115,CALLE DE NICARAGUA
http://www.group10.org/pl/resource/Street/S1116,CALLE NOVENA
http://www.group10.org/pl/resource/Street/S1117,CALLE OCTAVA
http://www.group10.org/pl/resource/Street/S1118,CALLE DE ORURO
http://www.group10.org/pl/resource/Street/S1119,CALLE DEL PADRE DAMIAN
