Identificador,nombre
http://www.group10.org/pl/resource/Street/S377,CALLE DEL PALO DE ROSA
http://www.group10.org/pl/resource/Street/S378,CALLE DE LAS PEÑUELAS
http://www.group10.org/pl/resource/Street/S379,CALLE DE POZUELO DE ZARZON
http://www.group10.org/pl/resource/Street/S380,CALLE DE SAN ANASTASIO
http://www.group10.org/pl/resource/Street/S381,CALLE DE SAN ISIDORO DE SEVILLA
http://www.group10.org/pl/resource/Street/S382,TRAVESIA DE SAN ISIDORO DE SEVILLA
http://www.group10.org/pl/resource/Street/S383,PASEO DE SANTA MARIA DE LA CABEZA
http://www.group10.org/pl/resource/Street/S384,CALLE DE SANTOCILDES
http://www.group10.org/pl/resource/Street/S385,CALLE DE SORIA
http://www.group10.org/pl/resource/Street/S386,CALLE DE VALDELASIERRA
http://www.group10.org/pl/resource/Street/S387,CALLE DE LA VILLA DE ARBANCON
http://www.group10.org/pl/resource/Street/S388,PASEO DE LAS YESERIAS
http://www.group10.org/pl/resource/Street/S389,CALLE DE AGUILON
http://www.group10.org/pl/resource/Street/S390,CALLE DE ALDEA DEL FRESNO
http://www.group10.org/pl/resource/Street/S391,CALLE DE ALEJANDRO SAINT AUBIN
http://www.group10.org/pl/resource/Street/S392,CALLE DE ALONSO CARBONELL
http://www.group10.org/pl/resource/Street/S393,CALLE DE BENITO VALDERAS
http://www.group10.org/pl/resource/Street/S394,CALLE DE CACERES
http://www.group10.org/pl/resource/Street/S395,PASEO DE LA CHOPERA
http://www.group10.org/pl/resource/Street/S396,CALLE DEL DIVINO VALLES
http://www.group10.org/pl/resource/Street/S397,CALLE DE DOMINGO PEREZ DEL VAL
http://www.group10.org/pl/resource/Street/S398,CALLE DE ENRIQUE TROMPETA
http://www.group10.org/pl/resource/Street/S399,CALLE DE EUGENIO SELLES
http://www.group10.org/pl/resource/Street/S400,CALLE DE FERNANDO POO
http://www.group10.org/pl/resource/Street/S401,PLAZA DEL GENERAL MAROTO
http://www.group10.org/pl/resource/Street/S402,CALLE DEL GENERAL PALANCA
http://www.group10.org/pl/resource/Street/S403,CALLE DE GUILLERMO DE OSMA
http://www.group10.org/pl/resource/Street/S404,CALLE DE JAIME EL CONQUISTADOR
http://www.group10.org/pl/resource/Street/S405,PLAZA DE JOSE DE VILLARREAL
http://www.group10.org/pl/resource/Street/S406,CALLE DE JOSE MIGUEL GORDOA
http://www.group10.org/pl/resource/Street/S407,CALLE DEL PARROCO JULIO MORATE
http://www.group10.org/pl/resource/Street/S408,PLAZA DE RUTILIO GACI
http://www.group10.org/pl/resource/Street/S409,CALLE DE SAN DANIEL
http://www.group10.org/pl/resource/Street/S410,CALLE DE SAN EVARISTO
http://www.group10.org/pl/resource/Street/S411,CALLE DE SAN FELIX
http://www.group10.org/pl/resource/Street/S412,CALLE DE TOMAS BORRAS
http://www.group10.org/pl/resource/Street/S413,CALLE DE TORRES MIRANDA
http://www.group10.org/pl/resource/Street/S414,CALLE DE LOS VOLUNTARIOS MACABEBES
http://www.group10.org/pl/resource/Street/S415,CALLE DE ALGETE
http://www.group10.org/pl/resource/Street/S416,CALLE DE ANDRES DE URDANETA
http://www.group10.org/pl/resource/Street/S417,CALLE DE LA ANTRACITA
http://www.group10.org/pl/resource/Street/S418,CALLE DE ARIEL
http://www.group10.org/pl/resource/Street/S419,CALLE DE BOLIVAR
http://www.group10.org/pl/resource/Street/S420,CALLE DEL BRONCE
http://www.group10.org/pl/resource/Street/S421,CALLE DEL CROMO
http://www.group10.org/pl/resource/Street/S422,CALLE DE EL SOTO
http://www.group10.org/pl/resource/Street/S423,CALLE DE ENRIQUE SIMONIS
http://www.group10.org/pl/resource/Street/S424,CALLE DE EROS
http://www.group10.org/pl/resource/Street/S425,CALLE DE LA ESTRELLA HADAR
http://www.group10.org/pl/resource/Street/S426,CALLE DE FRIGILIANA
http://www.group10.org/pl/resource/Street/S427,CALLE DEL HIERRO
http://www.group10.org/pl/resource/Street/S428,CALLE DE JOSE ANTONIO ZAPATA
http://www.group10.org/pl/resource/Street/S429,CALLE DE JULIAN RABANEDO
http://www.group10.org/pl/resource/Street/S430,CALLE DEL LITIO
http://www.group10.org/pl/resource/Street/S431,CALLE DEL MAESTRO ARBOS
http://www.group10.org/pl/resource/Street/S432,CALLE DE MANUEL ALEIXANDRE
http://www.group10.org/pl/resource/Street/S433,AVENIDA DEL MANZANARES
http://www.group10.org/pl/resource/Street/S434,CALLE DE MENDEZ ALVARO
http://www.group10.org/pl/resource/Street/S435,CALLE DE MENESES
http://www.group10.org/pl/resource/Street/S436,PASEO DEL MOLINO
http://www.group10.org/pl/resource/Street/S437,CALLE DE NEREIDA
http://www.group10.org/pl/resource/Street/S438,CALLE DE NERJA
http://www.group10.org/pl/resource/Street/S439,CALLE DE NESTARES
http://www.group10.org/pl/resource/Street/S440,CALLE DEL ONICE
http://www.group10.org/pl/resource/Street/S441,CALLE DEL PLANETA TIERRA
http://www.group10.org/pl/resource/Street/S442,CALLE DEL PLOMO
http://www.group10.org/pl/resource/Street/S443,CALLE DEL PUERTO DE BEJAR
http://www.group10.org/pl/resource/Street/S444,CALLE DEL PUERTO DE LA CRUZ VERDE
http://www.group10.org/pl/resource/Street/S445,CALLE DEL PUERTO DE MIRAVETE
http://www.group10.org/pl/resource/Street/S446,CALLE DE PUERTO SERRANO
http://www.group10.org/pl/resource/Street/S447,CALLE DE RICARDO DAMAS
http://www.group10.org/pl/resource/Street/S448,CALLE DE RICARDO GOIZUETA
http://www.group10.org/pl/resource/Street/S449,CALLE DEL RODIO
http://www.group10.org/pl/resource/Street/S450,CALLE DEL SODIO
http://www.group10.org/pl/resource/Street/S451,CALLE DEL TENIENTE CORONEL NOREÑA
http://www.group10.org/pl/resource/Street/S452,CALLE DE TERESA LOPEZ VALCARCEL
http://www.group10.org/pl/resource/Street/S453,CALLE DE TITAN
http://www.group10.org/pl/resource/Street/S454,CALLE DE VALDEMORILLO
http://www.group10.org/pl/resource/Street/S455,CALLE DE VILLARROBLEDO
http://www.group10.org/pl/resource/Street/S456,CALLE DE VIÑUELAS
http://www.group10.org/pl/resource/Street/S457,CALLE DE ALEJANDRO FERRANT
http://www.group10.org/pl/resource/Street/S458,CALLE DE ALICANTE
http://www.group10.org/pl/resource/Street/S459,CALLE DE ALONSO MARTOS
http://www.group10.org/pl/resource/Street/S460,CALLE DE AMALTEA
http://www.group10.org/pl/resource/Street/S461,PLAZA DEL AMANECER EN MENDEZ ALVARO
http://www.group10.org/pl/resource/Street/S462,CALLE DE LA BATALLA DEL SALADO
http://www.group10.org/pl/resource/Street/S463,CALLE DE BUSTAMANTE
http://www.group10.org/pl/resource/Street/S464,PLAZA DE CASAR DE CACERES
http://www.group10.org/pl/resource/Street/S465,CALLE DE CASTOR Y POLUX
http://www.group10.org/pl/resource/Street/S466,CALLE DE CIUDAD REAL
http://www.group10.org/pl/resource/Street/S467,CALLE DEL COBRE
http://www.group10.org/pl/resource/Street/S468,CALLE DEL CRISTO DEL CAMINO
http://www.group10.org/pl/resource/Street/S469,PASEO DE LAS DELICIAS
http://www.group10.org/pl/resource/Street/S470,CALLE DE EL ATAZAR
http://www.group10.org/pl/resource/Street/S471,CALLE DE LA ESTRELLA DENEBOLA
http://www.group10.org/pl/resource/Street/S472,CALLE DE LA ESTRELLA NAOS
http://www.group10.org/pl/resource/Street/S473,CALLE DE LA ESTRELLA SHAULA
http://www.group10.org/pl/resource/Street/S474,CALLE DEL FERROCARRIL
http://www.group10.org/pl/resource/Street/S475,CALLE DEL GENERAL LACY
http://www.group10.org/pl/resource/Street/S476,CALLE DEL GRANITO
http://www.group10.org/pl/resource/Street/S477,CALLE DE ISIDORO ÁLVAREZ ÁLVAREZ
http://www.group10.org/pl/resource/Street/S478,CALLE DE JUAN DE MARIANA
http://www.group10.org/pl/resource/Street/S479,CALLE DE JUAN DE VERA
http://www.group10.org/pl/resource/Street/S480,CALLE DE JUAN MARTIN EL EMPECINADO
http://www.group10.org/pl/resource/Street/S481,CALLE DE JUANA DOÑA
http://www.group10.org/pl/resource/Street/S482,CALLE DE LUIS PARET
http://www.group10.org/pl/resource/Street/S483,CALLE DE MEJORADA DEL CAMPO
http://www.group10.org/pl/resource/Street/S484,CALLE DEL MEZQUITE
http://www.group10.org/pl/resource/Street/S485,CALLE DE LAS NEBULOSAS
http://www.group10.org/pl/resource/Street/S486,CALLE DEL ORIANA
http://www.group10.org/pl/resource/Street/S487,CALLE DEL PARROCO EUSEBIO CUENCA
http://www.group10.org/pl/resource/Street/S488,CALLE DEL PATIO DE SERVICIO
http://www.group10.org/pl/resource/Street/S489,AVENIDA DEL PLANETARIO
http://www.group10.org/pl/resource/Street/S490,CALLE DE RAFAEL DE RIEGO
http://www.group10.org/pl/resource/Street/S491,CALLE DE RAMIREZ DE PRADO
http://www.group10.org/pl/resource/Street/S492,CALLE DEL SABAL
http://www.group10.org/pl/resource/Street/S493,CALLE DE TOMAS BRETON
http://www.group10.org/pl/resource/Street/S494,CALLE DE LA TURMALINA
http://www.group10.org/pl/resource/Street/S495,CALLE DE VARA DE REY
http://www.group10.org/pl/resource/Street/S496,CALLE DE VILLA DEL PRADO
http://www.group10.org/pl/resource/Street/S497,CALLE DE ALONSO DEL BARCO
http://www.group10.org/pl/resource/Street/S498,CALLE DEL ANCORA
http://www.group10.org/pl/resource/Street/S499,CALLE DE BERNARDINO OBREGON
http://www.group10.org/pl/resource/Street/S500,CALLE DE LAS CANARIAS
http://www.group10.org/pl/resource/Street/S501,CALLE DEL CARDENAL SOLIS
http://www.group10.org/pl/resource/Street/S502,CALLE DE LAS DELICIAS
http://www.group10.org/pl/resource/Street/S503,CALLE DE FRAY LUIS DE LEON
http://www.group10.org/pl/resource/Street/S504,CALLE DE JOSE ANTONIO DE ARMONA
http://www.group10.org/pl/resource/Street/S505,CALLE DE JOSE MARIA ROQUERO
http://www.group10.org/pl/resource/Street/S506,PLAZA DE LUCA DE TENA
http://www.group10.org/pl/resource/Street/S507,CALLE DEL MARQUES DE LA VALDAVIA
http://www.group10.org/pl/resource/Street/S508,CALLE DE MARTIN SOLER
http://www.group10.org/pl/resource/Street/S509,CALLE DE MURCIA
http://www.group10.org/pl/resource/Street/S510,CALLE DE PALOS DE LA FRONTERA
http://www.group10.org/pl/resource/Street/S511,CALLE DE PEDRO UNANUE
http://www.group10.org/pl/resource/Street/S512,CALLE DE SEBASTIAN ELCANO
http://www.group10.org/pl/resource/Street/S513,CALLE DE SEBASTIAN HERRERA
http://www.group10.org/pl/resource/Street/S514,CALLE DE TARRAGONA
http://www.group10.org/pl/resource/Street/S515,CALLE DE TORTOSA
http://www.group10.org/pl/resource/Street/S516,CALLE DE VIZCAYA
http://www.group10.org/pl/resource/Street/S517,CALLE DEL ACANTO
http://www.group10.org/pl/resource/Street/S518,CALLE DE ALAMEDILLA
http://www.group10.org/pl/resource/Street/S519,CALLE DEL ALMEZ
http://www.group10.org/pl/resource/Street/S520,CALLE DE ALPEDRETE
http://www.group10.org/pl/resource/Street/S521,CALLE DEL COMERCIO
http://www.group10.org/pl/resource/Street/S522,CALLE DE GARGANTA DE LOS MONTES
http://www.group10.org/pl/resource/Street/S523,CALLE DEL JACARANDA
http://www.group10.org/pl/resource/Street/S524,CALLE DE LA KENTIA
http://www.group10.org/pl/resource/Street/S525,CALLE DE LEGANES
http://www.group10.org/pl/resource/Street/S526,CALLE DEL OMBU
http://www.group10.org/pl/resource/Street/S527,CALLE DE LA RETAMA
http://www.group10.org/pl/resource/Street/S528,CALLE DEL TAMARINDO
http://www.group10.org/pl/resource/Street/S529,CALLE DEL TEJO
http://www.group10.org/pl/resource/Street/S530,CALLE DE ABTAO
http://www.group10.org/pl/resource/Street/S531,CALLE DE ANDRES TORREJON
http://www.group10.org/pl/resource/Street/S532,CALLE DE ANTONIO NEBRIJA
http://www.group10.org/pl/resource/Street/S533,CALLE DE BETANIA
http://www.group10.org/pl/resource/Street/S534,CALLE DE LA CARIDAD
http://www.group10.org/pl/resource/Street/S535,CALLE DE CAVANILLES
http://www.group10.org/pl/resource/Street/S536,PARTICULAR DE CAVANILLES
http://www.group10.org/pl/resource/Street/S537,PASAJE DE CAVANILLES
http://www.group10.org/pl/resource/Street/S538,CALLE DE LAS COCHERAS
http://www.group10.org/pl/resource/Street/S539,CALLE DEL DOCTOR ESQUERDO
http://www.group10.org/pl/resource/Street/S540,CALLE DE FUENTERRABIA
http://www.group10.org/pl/resource/Street/S541,CALLE DEL GENERAL VELARDE
http://www.group10.org/pl/resource/Street/S542,CALLE DE GRANADA
http://www.group10.org/pl/resource/Street/S543,CALLE DE GUTENBERG
http://www.group10.org/pl/resource/Street/S544,CALLE DE HOYUELO
http://www.group10.org/pl/resource/Street/S545,PASEO DE LA INFANTA ISABEL
http://www.group10.org/pl/resource/Street/S546,CALLE DE JOSE SANCHEZ PESCADOR
http://www.group10.org/pl/resource/Street/S547,CALLE DE JUAN DE URBIETA
http://www.group10.org/pl/resource/Street/S548,CALLE DE JULIAN GAYARRE
http://www.group10.org/pl/resource/Street/S549,CALLE DE LEON GIL DE PALACIO
http://www.group10.org/pl/resource/Street/S550,AVENIDA DEL MEDITERRANEO
http://www.group10.org/pl/resource/Street/S551,AVENIDA DE MENENDEZ PELAYO
http://www.group10.org/pl/resource/Street/S552,CALLE DE NARCISO SERRA
http://www.group10.org/pl/resource/Street/S553,CALLE DE NUESTRA SEÑORA DE LA PAZ
http://www.group10.org/pl/resource/Street/S554,CALLE DE PEDRO BOSCH
http://www.group10.org/pl/resource/Street/S555,CALLE DE LA REGALADA
http://www.group10.org/pl/resource/Street/S556,PASEO DE LA REINA CRISTINA
http://www.group10.org/pl/resource/Street/S557,CALLE DE SANCHEZ BARCAIZTEGUI
http://www.group10.org/pl/resource/Street/S558,CALLE DE TELLEZ
http://www.group10.org/pl/resource/Street/S559,TRAVESIA DE TELLEZ
http://www.group10.org/pl/resource/Street/S560,CALLE DE VALDERRIBAS
http://www.group10.org/pl/resource/Street/S561,CALLE DE VANDERGOTEN
http://www.group10.org/pl/resource/Street/S562,CALLE DE VIGO
http://www.group10.org/pl/resource/Street/S563,CALLE DE LAS ADELFAS
http://www.group10.org/pl/resource/Street/S564,CALLE DE AGUSTIN VIÑAMATA
http://www.group10.org/pl/resource/Street/S565,CALLE DE ANDALUCIA
http://www.group10.org/pl/resource/Street/S566,CALLE DE ARREGUI Y ARUEJ
http://www.group10.org/pl/resource/Street/S567,CALLE DE BARRILERO
http://www.group10.org/pl/resource/Street/S568,CALLE DEL CAFETO
http://www.group10.org/pl/resource/Street/S569,CALLE DE CALIFORNIA
http://www.group10.org/pl/resource/Street/S570,CALLE DE CARLOS Y GUILLERMO FERNANDEZ SHAW
http://www.group10.org/pl/resource/Street/S571,CALLE DE CATALINA SUAREZ
http://www.group10.org/pl/resource/Street/S572,CALLE DEL CERRO DE LA PLATA
http://www.group10.org/pl/resource/Street/S573,CALLE DEL CERRO NEGRO
http://www.group10.org/pl/resource/Street/S574,CALLE DE FEDERICO MORENO TORROBA
http://www.group10.org/pl/resource/Street/S575,CALLE DE FRANCISCO ABRIL
http://www.group10.org/pl/resource/Street/S576,CALLE DE GANDIA
http://www.group10.org/pl/resource/Street/S577,CALLE DE GARIBAY
http://www.group10.org/pl/resource/Street/S578,CALLE DE LOS HERMANOS RUIZ
http://www.group10.org/pl/resource/Street/S579,CALLE DE JATIVA
http://www.group10.org/pl/resource/Street/S580,CALLE DE JUAN DE JUANES
http://www.group10.org/pl/resource/Street/S581,CALLE DE LOS MESEJO
http://www.group10.org/pl/resource/Street/S582,CALLE DE LUIS MITJANS
http://www.group10.org/pl/resource/Street/S583,CALLE DE LUIS PEIDRO
http://www.group10.org/pl/resource/Street/S584,CALLE DE MARTINEZ CORROCHANO
http://www.group10.org/pl/resource/Street/S585,CALLE NUEVO BAZTAN
http://www.group10.org/pl/resource/Street/S586,CALLE DE LOS PAJARITOS
http://www.group10.org/pl/resource/Street/S587,CALLE DE SANTA SABINA
http://www.group10.org/pl/resource/Street/S588,CALLE DE SECO
http://www.group10.org/pl/resource/Street/S589,CALLE DE TRUEBA
http://www.group10.org/pl/resource/Street/S590,CALLE DE VALERIA
http://www.group10.org/pl/resource/Street/S591,CALLE DEL ALCALDE SAINZ DE BARANDA
http://www.group10.org/pl/resource/Street/S592,CALLE DE ANTONIO CASERO
http://www.group10.org/pl/resource/Street/S593,CALLE DE LOS ASTROS
http://www.group10.org/pl/resource/Street/S594,PLAZA DE LOS ASTROS
http://www.group10.org/pl/resource/Street/S595,PASAJE DE CAN MAYOR
http://www.group10.org/pl/resource/Street/S596,PASAJE DE CAN MENOR
http://www.group10.org/pl/resource/Street/S597,PASAJE DE CARENA
http://www.group10.org/pl/resource/Street/S598,CALLE DE LA CRUZ DEL SUR
http://www.group10.org/pl/resource/Street/S599,PASAJE DEL DORADO
http://www.group10.org/pl/resource/Street/S600,PASAJE DEL ESCUDO
http://www.group10.org/pl/resource/Street/S601,CALLE DE LA ESTRELLA POLAR
http://www.group10.org/pl/resource/Street/S602,CALLE DE JOSE MARTINEZ DE VELASCO
http://www.group10.org/pl/resource/Street/S603,CALLE DE JUAN ESPLANDIU
http://www.group10.org/pl/resource/Street/S604,CALLE DE LEO
http://www.group10.org/pl/resource/Street/S605,PASAJE DEL LINCE
http://www.group10.org/pl/resource/Street/S606,CALLE DE LA LIRA
http://www.group10.org/pl/resource/Street/S607,CALLE DEL MARQUES DE LOZOYA
http://www.group10.org/pl/resource/Street/S608,CALLE DE MATEO LOPEZ
http://www.group10.org/pl/resource/Street/S609,CALLE DE LA MONEDA
http://www.group10.org/pl/resource/Street/S610,CALLE DE O'DONNELL
http://www.group10.org/pl/resource/Street/S611,CALLE DEL PATIO DE LA LITOGRAFIA
http://www.group10.org/pl/resource/Street/S612,CALLE DE PERSEO
http://www.group10.org/pl/resource/Street/S613,CALLE DEL PEZ AUSTRAL
http://www.group10.org/pl/resource/Street/S614,CALLE DEL PEZ VOLADOR
http://www.group10.org/pl/resource/Street/S615,CALLE DE PISCIS
http://www.group10.org/pl/resource/Street/S616,CALLE DE RAFAEL SALAZAR ALONSO
http://www.group10.org/pl/resource/Street/S617,CALLE DE SALIENTE
http://www.group10.org/pl/resource/Street/S618,CALLE DE SAMARIA
http://www.group10.org/pl/resource/Street/S619,CALLE DE SIRIO
http://www.group10.org/pl/resource/Street/S620,CALLE DE VALORES
http://www.group10.org/pl/resource/Street/S621,CALLE DE LAS VAQUERIAS
http://www.group10.org/pl/resource/Street/S622,CALLE DE VICENTE CABALLERO
http://www.group10.org/pl/resource/Street/S623,CALLE DE ANTONIO ACUÑA
http://www.group10.org/pl/resource/Street/S624,CALLE DE ANTONIO ARIAS
http://www.group10.org/pl/resource/Street/S625,CALLE DEL DOCE DE OCTUBRE
http://www.group10.org/pl/resource/Street/S626,CALLE DEL DOCTOR CASTELO
http://www.group10.org/pl/resource/Street/S627,CALLE DE FERNAN GONZALEZ
http://www.group10.org/pl/resource/Street/S628,CALLE DE IBIZA
http://www.group10.org/pl/resource/Street/S629,CALLE DE LOPE DE RUEDA
http://www.group10.org/pl/resource/Street/S630,CALLE DE MAIQUEZ
http://www.group10.org/pl/resource/Street/S631,CALLE DE MENORCA
http://www.group10.org/pl/resource/Street/S632,CALLE DE NARVAEZ
http://www.group10.org/pl/resource/Street/S633,CALLE DE LA ACADEMIA
http://www.group10.org/pl/resource/Street/S634,CALLE DE AGUSTIN QUEROL
http://www.group10.org/pl/resource/Street/S635,CALLE DE ALBERTO BOSCH
http://www.group10.org/pl/resource/Street/S636,CALLE DE ALFONSO XI
http://www.group10.org/pl/resource/Street/S637,CALLE DE ALFONSO XII
http://www.group10.org/pl/resource/Street/S638,CALLE DE ANTONIO MAURA
http://www.group10.org/pl/resource/Street/S639,CALLE DE CASADO DEL ALISAL
http://www.group10.org/pl/resource/Street/S640,CALLE DEL DOCTOR VELASCO
http://www.group10.org/pl/resource/Street/S641,PASEO DE EL SALVADOR
http://www.group10.org/pl/resource/Street/S642,CALLE DE ESPALTER
http://www.group10.org/pl/resource/Street/S643,CALLE DE FELIPE IV
http://www.group10.org/pl/resource/Street/S644,CALLE DE JUAN DE MENA
http://www.group10.org/pl/resource/Street/S645,CALLE DE JUAN VALERA
http://www.group10.org/pl/resource/Street/S646,PLAZA DE LA LEALTAD
http://www.group10.org/pl/resource/Street/S647,CALLE DE LUIS CAMOENS
http://www.group10.org/pl/resource/Street/S648,PLAZA DE MARIANO DE CAVIA
http://www.group10.org/pl/resource/Street/S649,CALLE DE MENDEZ NUÑEZ
http://www.group10.org/pl/resource/Street/S650,CALLE DE MONTALBAN
http://www.group10.org/pl/resource/Street/S651,CALLE DE MORETO
http://www.group10.org/pl/resource/Street/S652,CALLE DEL POETA ESTEBAN DE VILLEGAS
http://www.group10.org/pl/resource/Street/S653,CALLE DE RUIZ DE ALARCON
http://www.group10.org/pl/resource/Street/S654,PASEO DE URUGUAY
http://www.group10.org/pl/resource/Street/S655,CALLE DE VALENZUELA
http://www.group10.org/pl/resource/Street/S656,CALLE DE AMADO NERVO
http://www.group10.org/pl/resource/Street/S657,CALLE DE ANGEL GANIVET
http://www.group10.org/pl/resource/Street/S658,CALLE DE ANTONIO BIENVENIDA
http://www.group10.org/pl/resource/Street/S659,CALLE DE ANTONIO DIAZ-CAÑABATE
http://www.group10.org/pl/resource/Street/S660,CALLE DE LA ANUNCIACION
http://www.group10.org/pl/resource/Street/S661,CALLE DE ARIAS MONTANO
http://www.group10.org/pl/resource/Street/S662,CALLE DE AVENDAÑO
http://www.group10.org/pl/resource/Street/S663,CALLE DEL CONDE DE CARTAGENA
http://www.group10.org/pl/resource/Street/S664,PLAZA DEL DOCTOR LAGUNA
http://www.group10.org/pl/resource/Street/S665,CALLE DE FRANCISCO VITORIA
http://www.group10.org/pl/resource/Street/S666,GLORIETA DE FUENTIDUEÑAS
http://www.group10.org/pl/resource/Street/S667,CALLE DE JERICO
http://www.group10.org/pl/resource/Street/S668,CALLE DE JESUS APRENDIZ
http://www.group10.org/pl/resource/Street/S669,CALLE DE JUAN DE JAUREGUI
http://www.group10.org/pl/resource/Street/S670,CALLE DE JULIO REY PASTOR
http://www.group10.org/pl/resource/Street/S671,CALLE DE MARTIN SARMIENTO
http://www.group10.org/pl/resource/Street/S672,AVENIDA DE NAZARET
http://www.group10.org/pl/resource/Street/S673,PLAZA DEL NIÑO JESUS
http://www.group10.org/pl/resource/Street/S674,CALLE DE PILAR MILLAN ASTRAY
http://www.group10.org/pl/resource/Street/S675,CALLE DE PIO BAROJA
http://www.group10.org/pl/resource/Street/S676,CALLE DEL PORTAL DE BELEN
http://www.group10.org/pl/resource/Street/S677,CALLE DE LOS REYES MAGOS
http://www.group10.org/pl/resource/Street/S678,PLAZA DE LOS REYES MAGOS
http://www.group10.org/pl/resource/Street/S679,CALLE DE RONCESVALLES
http://www.group10.org/pl/resource/Street/S680,CALLE DE TITULCIA
http://www.group10.org/pl/resource/Street/S681,CALLE DE VIERA Y CLAVIJO
http://www.group10.org/pl/resource/Street/S682,CALLE DE LA VIRGEN MARIA
http://www.group10.org/pl/resource/Street/S683,CALLE DE WALIA
http://www.group10.org/pl/resource/Street/S684,CALLE DE AGUIRRE
http://www.group10.org/pl/resource/Street/S685,CALLE DE ALCALA
http://www.group10.org/pl/resource/Street/S686,CALLE DE AYALA
http://www.group10.org/pl/resource/Street/S687,PASEO DE LA CASTELLANA
http://www.group10.org/pl/resource/Street/S688,CALLE DE CASTELLO
http://www.group10.org/pl/resource/Street/S689,CALLE DEL CID
http://www.group10.org/pl/resource/Street/S690,CALLE DE CLAUDIO COELLO
http://www.group10.org/pl/resource/Street/S691,CALLE DE COLUMELA
http://www.group10.org/pl/resource/Street/S692,CALLE DEL CONDE DE ARANDA
http://www.group10.org/pl/resource/Street/S693,CALLE DE DON RAMON DE LA CRUZ
http://www.group10.org/pl/resource/Street/S694,CALLE DE GOYA
http://www.group10.org/pl/resource/Street/S695,CALLE DE GURTUBAY
http://www.group10.org/pl/resource/Street/S696,CALLE DE HERMOSILLA
http://www.group10.org/pl/resource/Street/S697,CALLE DE LAGASCA
http://www.group10.org/pl/resource/Street/S698,CALLE DEL MARQUES DE ZURGENA
http://www.group10.org/pl/resource/Street/S699,CALLE DEL MARQUES DEL DUERO
http://www.group10.org/pl/resource/Street/S700,CALLE DE NUÑEZ DE BALBOA
http://www.group10.org/pl/resource/Street/S701,CALLE DE PEDRO MUÑOZ SECA
http://www.group10.org/pl/resource/Street/S702,CALLE DE RECOLETOS
http://www.group10.org/pl/resource/Street/S703,PASEO DE RECOLETOS
http://www.group10.org/pl/resource/Street/S704,CALLE DE SALUSTIANO OLOZAGA
http://www.group10.org/pl/resource/Street/S705,CALLE DE VELAZQUEZ
http://www.group10.org/pl/resource/Street/S706,CALLE DE VILLALAR
http://www.group10.org/pl/resource/Street/S707,CALLE DE VILLANUEVA
http://www.group10.org/pl/resource/Street/S708,CALLE DE ALCANTARA
http://www.group10.org/pl/resource/Street/S709,CALLE DEL DUQUE DE SESTO
http://www.group10.org/pl/resource/Street/S710,PASAJE DE ENRIQUE RUANO
http://www.group10.org/pl/resource/Street/S711,CALLE DE ESPARTINAS
http://www.group10.org/pl/resource/Street/S712,CALLE DE FRANCISCA MORENO
http://www.group10.org/pl/resource/Street/S713,CALLE DE LA FUENTE DEL BERRO
http://www.group10.org/pl/resource/Street/S714,CALLE DEL GENERAL DIAZ PORLIER
http://www.group10.org/pl/resource/Street/S715,CALLE DEL GENERAL PARDIÑAS
http://www.group10.org/pl/resource/Street/S716,CALLE DEL JARDIN DE SAN FEDERICO
http://www.group10.org/pl/resource/Street/S717,CALLE DE JORGE JUAN
http://www.group10.org/pl/resource/Street/S718,CALLE DE LOMBIA
http://www.group10.org/pl/resource/Street/S719,CALLE DEL MAESTRO VIVES
http://www.group10.org/pl/resource/Street/S720,CALLE DE LAS MARTIRES CONCEPCIONISTAS
http://www.group10.org/pl/resource/Street/S721,CALLE DE MONTESA
http://www.group10.org/pl/resource/Street/S722,CALLE DE LAS NACIONES
http://www.group10.org/pl/resource/Street/S723,CALLE DE POVEDILLA
http://www.group10.org/pl/resource/Street/S724,CALLE DEL PRINCIPE DE ASTURIAS
http://www.group10.org/pl/resource/Street/S725,CALLE DE AIZGORRI
http://www.group10.org/pl/resource/Street/S726,CALLE DE ALEJANDRO GONZALEZ
http://www.group10.org/pl/resource/Street/S727,CALLE DE ALMERIA
http://www.group10.org/pl/resource/Street/S728,CALLE DE AMBROS
http://www.group10.org/pl/resource/Street/S729,PLAZA DE AMERICA ESPAÑOLA
http://www.group10.org/pl/resource/Street/S730,CALLE DE ANDRES BELLO
http://www.group10.org/pl/resource/Street/S731,CALLE DE ANTONIO TOLEDANO
http://www.group10.org/pl/resource/Street/S732,CALLE DE ARALAR
http://www.group10.org/pl/resource/Street/S733,CALLE DEL AZULEJO
http://www.group10.org/pl/resource/Street/S734,CALLE DE BASILIO PARAISO
http://www.group10.org/pl/resource/Street/S735,CALLE DE BEGOÑA
http://www.group10.org/pl/resource/Street/S736,CALLE DE BENITO DE CASTRO
http://www.group10.org/pl/resource/Street/S737,CALLE DE BOCANGEL
http://www.group10.org/pl/resource/Street/S738,CALLE DE CONCEPCION BAHAMONDE
http://www.group10.org/pl/resource/Street/S739,CALLE DE LOS CONDES DE TORREANAZ
http://www.group10.org/pl/resource/Street/S740,CALLE DE DANIEL ZULOAGA
http://www.group10.org/pl/resource/Street/S741,CALLE DE DEMETRIO SANCHEZ
http://www.group10.org/pl/resource/Street/S742,CALLE DE DIEGO BAHAMONDE
http://www.group10.org/pl/resource/Street/S743,CALLE DE DOLORES ROMERO
http://www.group10.org/pl/resource/Street/S744,CALLE DE ELVIRA
http://www.group10.org/pl/resource/Street/S745,CALLE DE ENRIQUE D'ALMONTE
http://www.group10.org/pl/resource/Street/S746,CALLE DE FLORENCIO DIAZ
http://www.group10.org/pl/resource/Street/S747,CALLE DE LOS FUNDADORES
http://www.group10.org/pl/resource/Street/S748,CALLE DE ITURBE
